{
  "$schema": "../../schemas/developer-tool.schema.json",
  "slug": "claude-mnemonic",
  "name": "claude-mnemonic",
  "description": "Two-stage retrieval memory system with bi-encoder semantic search and cross-encoder reranking, built on SQLite.",
  "url": "https://github.com/lukaszraczylo/claude-mnemonic",
  "repo": "https://github.com/lukaszraczylo/claude-mnemonic",
  "language": ["Go"],
  "approach": ["vector", "reranking"],
  "approachDetail": "Two-stage retrieval: bi-encoder semantic search then cross-encoder reranking. SQLite with FTS5 + sqlite-vec, ONNX embeddings",
  "category": "developer-tools",
  "search": ["semantic", "keyword", "reranking"],
  "searchDetail": "FTS5 for exact matches, sqlite-vec for semantic search, BGE cross-encoder reranking",
  "storage": ["SQLite"],
  "storageDetail": "SQLite with FTS5 and sqlite-vec, all-MiniLM-L6-v2 embeddings via ONNX",
  "mcpSupport": "yes",
  "mcpDetail": "Exposes search, timeline, decisions, changes, and how_it_works tools",
  "toolSupport": ["Claude Code", "Any MCP client"],
  "scopes": ["project", "global"],
  "scopesDetail": "Auto-classifies as project-local or global based on tags like best-practice, security, architecture",
  "duplicateDetection": ["conflict detection", "supersede"],
  "duplicateDetail": "Detects contradictory observations, memories can be superseded",
  "retention": ["importance decay", "voting"],
  "retentionDetail": "Observation lifecycle with supersede/archive, importance scoring with time decay and voting",
  "multiUser": "no",
  "crossMachine": "no",
  "crossMachineDetail": "Local plugin, memories stay on one machine",
  "webUi": "yes",
  "webUiDetail": "Dashboard at localhost:37777 for browsing and managing memories",
  "tokenBudgeting": ["configurable limits"],
  "tokenBudgetingDetail": "Max 100 observations, 25 full-detail, 10 sessions per query — configurable limits",
  "setupComplexity": "low",
  "maturity": "beta",
  "pros": ["Advanced reranking for precision", "Conflict detection", "Importance decay scoring", "Auto-classification"],
  "cons": ["Local-only", "No multi-user"]
}