{
  "slug": "supermemory",
  "name": "Supermemory",
  "description": "Cloud-hosted vector memory service with automatic contradiction detection and multi-tenant support.",
  "url": "https://github.com/supermemoryai/supermemory",
  "repo": "https://github.com/supermemoryai/supermemory",
  "language": ["Cloud service"],
  "approach": ["vector"],
  "approachDetail": "Vector search plus document-level indexing",
  "category": "developer-tools",
  "search": ["semantic"],
  "storage": ["cloud"],
  "mcpSupport": "yes",
  "toolSupport": ["Claude Code", "Any MCP client"],
  "scopes": ["container tags"],
  "duplicateDetection": ["auto", "contradiction detection"],
  "duplicateDetail": "Detects and resolves contradictions between memories automatically",
  "retention": ["auto-expiry"],
  "multiUser": "yes",
  "multiUserDetail": "Cloud-hosted, multi-tenant",
  "crossMachine": "yes",
  "crossMachineDetail": "Cloud-hosted, inherently cross-machine",
  "webUi": "no",
  "tokenBudgeting": ["none"],
  "setupComplexity": "low",
  "maturity": "beta",
  "pros": ["Cloud-hosted, zero infra", "Cross-machine by default", "Multi-user", "Contradiction detection"],
  "cons": ["Cloud dependency", "No web UI", "No token budgeting"]
}