{
  "$schema": "../../schemas/developer-tool.schema.json",
  "slug": "claude-mem",
  "name": "claude-mem",
  "description": "MCP memory server using ChromaDB for vector storage with AI-powered memory compression and merging.",
  "url": "https://github.com/thedotmack/claude-mem",
  "repo": "https://github.com/thedotmack/claude-mem",
  "language": ["TypeScript"],
  "approach": ["vector"],
  "approachDetail": "ChromaDB for vectors, local embedding",
  "category": "developer-tools",
  "search": ["semantic", "keyword"],
  "storage": ["SQLite", "ChromaDB"],
  "mcpSupport": "yes",
  "toolSupport": ["Claude Code", "Any MCP client"],
  "scopes": ["project"],
  "duplicateDetection": ["AI compression"],
  "duplicateDetail": "LLM compresses and merges related memories automatically",
  "retention": ["none"],
  "multiUser": "no",
  "crossMachine": "no",
  "crossMachineDetail": "Runs locally per machine, memories don't sync",
  "webUi": "yes",
  "webUiDetail": "Memory viewer for browsing stored memories",
  "tokenBudgeting": ["progressive disclosure"],
  "tokenBudgetingDetail": "Progressively discloses more context as conversation develops",
  "setupComplexity": "low",
  "maturity": "alpha",
  "pros": ["AI-powered memory compression", "Simple setup", "Progressive context disclosure"],
  "cons": ["Local-only", "No multi-user", "No retention/TTL"]
}