{
  "$schema": "../../schemas/developer-tool.schema.json",
  "slug": "knowledge-bank",
  "name": "knowledge-bank",
  "description": "Knowledge management system with SQLite FTS5 full-text search and automatic type/scope classification.",
  "url": "https://github.com/gabrywu-public/knowledge-bank",
  "repo": "https://github.com/gabrywu-public/knowledge-bank",
  "language": ["TypeScript"],
  "approach": ["FTS"],
  "approachDetail": "SQLite FTS5 full-text search",
  "category": "developer-tools",
  "search": ["keyword"],
  "storage": ["SQLite"],
  "mcpSupport": "no",
  "toolSupport": ["CLI"],
  "scopes": ["type", "scope"],
  "scopesDetail": "Memories classified by type and scope automatically",
  "duplicateDetection": ["none"],
  "retention": ["none"],
  "multiUser": "no",
  "crossMachine": "no",
  "crossMachineDetail": "Local npm server, no remote access",
  "webUi": "yes",
  "webUiDetail": "Dashboard for browsing and managing knowledge entries",
  "tokenBudgeting": ["none"],
  "setupComplexity": "low",
  "maturity": "alpha",
  "pros": ["Simple FTS search", "Type classification", "Web dashboard"],
  "cons": ["Keyword search only", "No dedup", "Local-only", "No MCP"]
}