{
  "slug": "claude-memory-api",
  "name": "Claude Memory API",
  "description": "Claude Memory API (memory_20250818). A client-side tool where Claude emits file operations and your application handles storage. Anthropic stores nothing.",
  "url": "https://docs.anthropic.com/en/docs/agents-and-tools/tool-use/memory-tool",
  "language": ["Proprietary"],
  "approach": ["client-side tool"],
  "category": "developer-tools",
  "search": ["none"],
  "storage": ["bring your own"],
  "mcpSupport": "no",
  "toolSupport": ["Any Claude API client"],
  "scopes": ["custom"],
  "duplicateDetection": ["none"],
  "retention": ["none"],
  "multiUser": "no",
  "multiUserDetail": "Depends on your storage backend",
  "crossMachine": "no",
  "crossMachineDetail": "Depends on your storage backend",
  "webUi": "no",
  "tokenBudgeting": ["none"],
  "maturity": "beta",
  "pros": ["Full control over storage", "Works with any backend", "Native Claude integration"],
  "cons": ["You must implement storage", "No built-in search/dedup/retention", "API-only"]
}