{
  "slug": "khoj",
  "name": "Khoj",
  "description": "AI personal assistant with vector search, document indexing, cloud sync, and multi-platform support.",
  "url": "https://github.com/khoj-ai/khoj",
  "repo": "https://github.com/khoj-ai/khoj",
  "language": ["Python"],
  "approach": ["vector", "document index"],
  "category": "developer-tools",
  "search": ["semantic", "keyword"],
  "storage": ["SQLite", "cloud"],
  "mcpSupport": "yes",
  "toolSupport": ["Claude Code", "Any MCP client", "Web", "Desktop", "Mobile"],
  "scopes": ["per-agent KB"],
  "duplicateDetection": ["none"],
  "retention": ["none"],
  "multiUser": "yes",
  "crossMachine": "yes",
  "crossMachineDetail": "Has cloud sync and self-hosted server mode",
  "webUi": "yes",
  "tokenBudgeting": ["none"],
  "setupComplexity": "medium",
  "maturity": "stable",
  "pros": ["Multi-platform (web, desktop, mobile)", "Cloud sync", "Multi-user", "Self-hosted option"],
  "cons": ["No token budgeting", "No dedup", "No retention/TTL"]
}