{
  "slug": "claude-total-memory",
  "name": "claude-total-memory",
  "description": "4-tier hybrid memory with semantic, keyword, fuzzy, and graph search. Categorizes memories into 5 knowledge types with retention zones.",
  "url": "https://github.com/vbcherepanov/claude-total-memory",
  "repo": "https://github.com/vbcherepanov/claude-total-memory",
  "language": ["Python"],
  "approach": ["hybrid"],
  "approachDetail": "4-tier hybrid: FTS5 keyword (BM25), ChromaDB semantic, fuzzy matching, knowledge graph expansion. 5 knowledge types",
  "category": "developer-tools",
  "search": ["semantic", "keyword", "fuzzy", "graph"],
  "searchDetail": "FTS5 BM25, ChromaDB semantic, SequenceMatcher fuzzy, knowledge graph expansion",
  "storage": ["SQLite", "ChromaDB"],
  "storageDetail": "SQLite with FTS5 for structured data, ChromaDB with all-MiniLM-L6-v2 for vectors",
  "mcpSupport": "yes",
  "mcpDetail": "20 MCP tools: recall, save, search, timeline, stats, graph relations, self-improvement, and more",
  "toolSupport": ["Claude Code", "Any MCP client"],
  "scopes": ["knowledge types"],
  "scopesDetail": "5 knowledge types: decision, solution, lesson, fact, convention. Tagged and categorized automatically",
  "duplicateDetection": ["jaccard", "fuzzy", "versioning"],
  "duplicateDetail": "Jaccard similarity (0.85) + fuzzy matching (0.90) with version history and supersession chains",
  "retention": ["retention zones", "decay scoring"],
  "retentionDetail": "Retention zones: Active → Archived (180d) → Purged (365d). Decay scoring with 90-day half-life",
  "multiUser": "no",
  "crossMachine": "no",
  "crossMachineDetail": "Local-only, all data in ~/.claude-memory",
  "webUi": "yes",
  "webUiDetail": "Flask dashboard at localhost:37737 — stats, health score, knowledge graph visualization",
  "tokenBudgeting": ["progressive disclosure"],
  "tokenBudgetingDetail": "3-level progressive disclosure (compact ~50 tokens, summary 150 chars, full)",
  "setupComplexity": "medium",
  "maturity": "alpha",
  "pros": ["Rich 4-tier search", "Knowledge type classification", "Retention zones with decay", "Graph expansion"],
  "cons": ["Local-only", "Complex setup", "No multi-user"]
}