{
  "$schema": "../../schemas/developer-tool.schema.json",
  "slug": "lisa",
  "name": "lisa",
  "description": "Knowledge graph memory system using Neo4j for entity relationships and graph-based retrieval.",
  "url": "https://github.com/TonyCasey/lisa",
  "repo": "https://github.com/TonyCasey/lisa",
  "language": ["TypeScript"],
  "approach": ["knowledge graph"],
  "approachDetail": "Full Neo4j graph database with entity relationships",
  "category": "developer-tools",
  "search": ["graph", "semantic"],
  "storage": ["Neo4j"],
  "mcpSupport": "no",
  "toolSupport": ["CLI"],
  "scopes": ["project"],
  "duplicateDetection": ["entity resolution"],
  "retention": ["temporal tracking"],
  "multiUser": "no",
  "crossMachine": "partial",
  "crossMachineDetail": "Possible if Neo4j is hosted on a server, but not the default setup",
  "webUi": "no",
  "tokenBudgeting": ["none"],
  "setupComplexity": "high",
  "maturity": "alpha",
  "pros": ["Full graph database with Neo4j", "Entity resolution", "Temporal tracking"],
  "cons": ["Requires Neo4j infrastructure", "No MCP support", "No web UI"]
}