{
  "$schema": "../../schemas/developer-tool.schema.json",
  "slug": "mcp-memory-service",
  "name": "mcp-memory-service",
  "description": "Hybrid memory service combining vector search, knowledge graph, and BM25 with optional Cloudflare cloud sync.",
  "url": "https://github.com/doobidoo/mcp-memory-service",
  "repo": "https://github.com/doobidoo/mcp-memory-service",
  "language": ["Python"],
  "approach": ["hybrid"],
  "approachDetail": "Vector embeddings (MiniLM-L6-v2 via ONNX) + knowledge graph with typed relations + BM25 keyword search",
  "category": "developer-tools",
  "search": ["semantic", "keyword", "graph"],
  "searchDetail": "Vector semantic search + BM25 keyword + knowledge graph expansion with typed relations",
  "storage": ["SQLite"],
  "storageDetail": "SQLite-vec for vectors, optional Cloudflare Workers + Vectorize for cloud sync",
  "mcpSupport": "yes",
  "mcpDetail": "MCP server + REST API, works with Claude Desktop, Claude Code, LangGraph, CrewAI, AutoGen",
  "toolSupport": ["Claude Code", "Claude Desktop", "LangGraph", "CrewAI", "AutoGen", "Any MCP client"],
  "scopes": ["per-agent"],
  "scopesDetail": "Automatic agent-ID tagging via X-Agent-ID header for per-agent memory scoping",
  "duplicateDetection": ["semantic", "consolidation"],
  "duplicateDetail": "Semantic dedup with conversation_id bypass for incremental saves",
  "retention": ["none"],
  "multiUser": "partial",
  "multiUserDetail": "Team collaboration via optional Cloudflare backend",
  "crossMachine": "partial",
  "crossMachineDetail": "Local-first with optional Cloudflare cloud sync for cross-machine access",
  "webUi": "yes",
  "webUiDetail": "8-tab dashboard at localhost:8000 — search, browse, documents, analytics, quality scoring, D3.js knowledge graph visualization",
  "tokenBudgeting": ["none"],
  "setupComplexity": "medium",
  "maturity": "beta",
  "pros": ["Hybrid search approach", "Knowledge graph with typed relations", "Optional cloud sync", "Rich dashboard", "Wide tool support"],
  "cons": ["Complex setup with optional cloud", "Token budgeting not supported"]
}