{
  "slug": "claude-diary",
  "name": "claude-diary",
  "description": "Simple file-based memory using markdown files. The AI reads diary entries at session start.",
  "url": "https://github.com/rlancemartin/claude-diary",
  "repo": "https://github.com/rlancemartin/claude-diary",
  "language": ["Shell"],
  "approach": ["file-based"],
  "category": "developer-tools",
  "search": ["none"],
  "storage": ["markdown files"],
  "mcpSupport": "no",
  "toolSupport": ["Claude Code"],
  "scopes": ["project"],
  "duplicateDetection": ["LLM reflection"],
  "duplicateDetail": "LLM reflects on existing memories before adding new ones",
  "retention": ["none"],
  "multiUser": "no",
  "crossMachine": "no",
  "crossMachineDetail": "Local markdown files, no sync",
  "webUi": "no",
  "tokenBudgeting": ["none"],
  "setupComplexity": "low",
  "maturity": "stable",
  "pros": ["Zero dependencies", "Dead simple setup", "Works with any tool that reads files"],
  "cons": ["No search", "No dedup", "Doesn't scale", "No scoping"]
}