{
  "slug": "yams",
  "name": "trvon/yams",
  "description": "Content-addressed storage with SHA-256 hashing and block-level dedup. More 'smart git' than traditional memory system.",
  "url": "https://github.com/trvon/yams",
  "repo": "https://github.com/trvon/yams",
  "language": ["C++"],
  "approach": ["content-addressed"],
  "approachDetail": "SHA-256 content hashing, block-level dedup, more 'smart git' than memory",
  "category": "developer-tools",
  "search": ["keyword", "vector"],
  "searchDetail": "SQLite FTS5 with optional vector search layer",
  "storage": ["SQLite", "blob store"],
  "mcpSupport": "yes",
  "toolSupport": ["Claude Code", "Any MCP client"],
  "scopes": ["N/A"],
  "duplicateDetection": ["content hash"],
  "duplicateDetail": "SHA-256 content hash",
  "retention": ["none"],
  "multiUser": "no",
  "crossMachine": "no",
  "crossMachineDetail": "Local binary, no remote access",
  "webUi": "no",
  "tokenBudgeting": ["none"],
  "setupComplexity": "medium",
  "maturity": "alpha",
  "pros": ["Efficient content-addressed storage", "Block-level dedup", "FTS5 search"],
  "cons": ["Not designed for discrete memories", "Local-only", "No retention"]
}