{
  "$schema": "../../schemas/developer-tool.schema.json",
  "slug": "claude-code-auto-memory",
  "name": "Claude Code Auto Memory",
  "description": "Claude Code's built-in memory system. Writes notes to ~/.claude/projects/*/memory/MEMORY.md as it works. Plain markdown, machine-local.",
  "url": "https://docs.anthropic.com/en/docs/claude-code",
  "language": ["Proprietary"],
  "approach": ["file-based"],
  "category": "developer-tools",
  "search": ["none"],
  "storage": ["markdown files"],
  "mcpSupport": "no",
  "toolSupport": ["Claude Code"],
  "scopes": ["project"],
  "duplicateDetection": ["none"],
  "retention": ["none"],
  "multiUser": "no",
  "crossMachine": "no",
  "crossMachineDetail": "Stored in ~/.claude/projects/, machine-local",
  "webUi": "no",
  "tokenBudgeting": ["none"],
  "maturity": "stable",
  "pros": ["Zero setup", "Automatic", "Part of Claude Code"],
  "cons": ["No search", "No sync", "No scoping beyond project", "Plain markdown only"]
}